{
  "id": "@pwpack/fixture/l1-static",
  "version": "1.0.0",
  "formatVersion": "1.0",
  "engines": {
    "pwfabric": ">=1.0 <2"
  },
  "requires": [
    {
      "id": "@pwpack/fixture/foundation",
      "range": "^1.0.0"
    }
  ],
  "packs": [
    {
      "id": "@pwpack/fixture/foundation",
      "version": "1.0.0",
      "hash": "sha256:e4e75ba88b84f9e490eec6fe9366158e19e75f230eead22be5322183073aebff"
    }
  ],
  "license": {
    "fork": true,
    "redistribute": true
  },
  "app": {
    "entry": "home",
    "surfaceOrder": [
      "home",
      "about"
    ]
  }
}
